{
  "contact": {
    "name": "Jane Doe",
    "email": "jane@example.com",
    "phone": null,
    "location": "Nagpur, India",
    "linkedin_url": null,
    "github_url": null,
    "portfolio_url": null
  },
  "summary": "GenAI developer with production LangGraph and RAG experience.",
  "skills": ["Python", "LangGraph", "RAG", "Pinecone", "FastAPI"],
  "experience": [
    {
      "company": "AIQoD",
      "title": "AI/ML Developer",
      "start_date": "May 2025",
      "end_date": "Present",
      "location": null,
      "achievements": [
        "Built a multi-agent LangGraph workflow for autonomous tool generation."
      ]
    }
  ],
  "education": [
    {
      "institution": "Some University",
      "degree": "B.E.",
      "field": "Computer Science",
      "start_date": "2018",
      "end_date": "2022",
      "marks": "87%"
    }
  ],
  "projects": [
    {
      "name": "LeadGen Bot",
      "technologies": ["Python", "LangGraph"],
      "start_date": null,
      "end_date": null,
      "url": null,
      "achievements": ["Built a multi-agent lead generation system"]
    }
  ],
  "certifications": ["AWS Certified"],
  "resume_facts": [
    "Company: AIQoD",
    "Title: AI/ML Developer",
    "Skill: LangGraph"
  ]
}
